ticker,exchange,Category,Industry,Sector,market_cap_category,Growth Metric (%),P/E Ratio,Industry Median P/E,Earnings Per Share,Price-to-Book,Industry Median PB,EPS Growth (%),Dividend Yield (%),1-Month Return (%),3-Month Return (%),6-Month Return (%),1-Year Return (%),Business Description
TFPM,NYSE,Growth,Other Precious Metals & Mining,Basic Materials,mid,111.08,35.930233,38.67,0.86,3.4329517,3.44,,0.72,10.99,30.05,40.81,74.51,"Triple Flag Precious Metals Corp., a precious metals streaming and royalty company, engages in acquiring and managing precious metals, streams, royalties, and other mineral interests in Australia, Canada, Colombia, Cote d'Ivoire, Honduras, Mexico, Mongolia, Peru, South Africa, and the United States. It has a portfolio of streams and royalties providing exposure to copper, gold, silver, nickel, lead, and zinc. The company was founded in 2016 and is based in Toronto, Canada."
CLS,NYSE,Growth,Electronic Components,Technology,large,96.6,60.230934,38.87,4.59,18.085829,3.73,122.10000000000001,0.0,9.69,69.59,228.96,378.14,"Celestica Inc., together with its subsidiaries, provides supply chain solutions in Asia, North America, and internationally. It operates through two segments, Advanced Technology Solutions, and Connectivity and Cloud Solutions. The company offers a range of product manufacturing and related supply chain services, including design and development, new product introduction, engineering services, component sourcing, electronics manufacturing and assembly, testing, mechanical assembly, systems integration, precision machining, order fulfillment, logistics, asset management, product licensing, and after-market repair and return services. It also provides hardware platform solutions, which includes development of infrastructure platforms, and hardware and software design solutions and services, including open-source software that can be used as-is or customized for specific applications; and management of program, including design and supply chain, manufacturing, and after-market support, including IT asset disposition and asset management services. The company offers its products and services to original equipment manufacturers, and cloud-based and other service providers, including hyperscalers, and other companies in aerospace and defense, industrial, HealthTech, capital equipment, communications, and enterprise markets. Celestica Inc. was incorporated in 1994 and is headquartered in Toronto, Canada."
HOOD,NASDAQ,Growth,Capital Markets,Financial Services,large,95.87,65.94416,20.0,1.97,14.294674,2.42,105.3,0.0,7.44,24.51,215.47,384.2,"Robinhood Markets, Inc. operates financial services platform in the United States. Its platform allows users to invest in stocks, exchange-traded funds (ETFs), American depository receipts, options, gold, and cryptocurrencies. The company offers fractional trading, recurring investments, fully-paid securities lending, access to investing on margin, cash sweep, instant withdrawals, retirement program, around-the-clock trading, joint investing accounts, event contracts, and future contract services. It also provides various learning and education solutions comprise Snacks, an accessible digest of business news stories for a new generation of investors.; Learn, which is an online collection of guides, feature tutorials, and financial dictionary; Newsfeeds that offer access to free, premium news from sites from various sites, such as Barron's, Reuters, and Dow Jones. In addition, the company offers In-App Education, a resource that covers investing fundamentals, including why people invest, a stock market overview, and tips on how to define investing goals, as well as allows customers to understand the basics of investing before their first trade; and Crypto Learn and Earn, an educational module available to various crypto customers through Robinhood Learn to teach customers the basics related to cryptocurrency. Further, it provides Robinhood credit cards, cash card and spending accounts, and wallets. The company also owns and operates a digital currency marketplace that allows companies and individuals from all around the world to buy and sell bitcoin, litecoin, ethereum, ripple, and bitcoin cash. Robinhood Markets, Inc. was incorporated in 2013 and is headquartered in Menlo Park, California."
KGC,NYSE,Growth,Gold,Basic Materials,large,95.01,20.241936,28.99,1.24,4.0496936,3.96,151.6,0.48,12.76,57.91,70.21,138.78,"Kinross Gold Corporation, together with its subsidiaries, engages in the acquisition, exploration, and development of gold properties principally in the United States, Brazil, Chile, Canada, and Mauritania. It is also involved in the extraction and processing of gold-containing ores; reclamation of gold mining properties; and production and sale of silver. Kinross Gold Corporation was founded in 1993 and is headquartered in Toronto, Canada."
KTOS,NASDAQ,Growth,Aerospace & Defense,Industrials,large,89.9,831.2,39.05,0.1,7.148263,4.06,-63.3,0.0,3.06,41.41,151.19,234.49,"Kratos Defense & Security Solutions, Inc., a technology company, provides technology, products, and system and software for the defense, national security, and commercial markets in the United States, other North America, the Asia Pacific, the Middle East, Europe, and Internationally. The company operates in two segments, Kratos Government Solutions and Unmanned Systems. It offers ground systems for satellites and space vehicles, including software for command and control, telemetry, and tracking and control; jet powered unmanned aerial drone systems, hypersonic vehicles, and rocket systems; propulsion systems for drones, missiles, loitering munitions, supersonic systems, spacecraft, and launch systems; command, control, communication, computing, combat, and intelligence surveillance and reconnaissance; and microwave electronic products for missile, radar, missile defense, space, and satellite; and counter unmanned aircraft systems, directed energy, communication and other systems, and virtual and augmented reality training systems for the warfighter. The company primarily serves national security-related agencies, the U.S. Department of Defense, intelligence and classified agencies, international government agencies, and commercial customers. Kratos Defense & Security Solutions, Inc. was incorporated in 1994 and is headquartered in San Diego, California."
CDE,NYSE,Growth,Gold,Basic Materials,large,88.29,52.624996,28.99,0.4,4.783004,3.96,4859.7,0.0,29.3,122.52,249.09,196.48,"Coeur Mining, Inc. operates as a gold and silver producer in the United States, Canada, and Mexico. It operates through Palmarejo, Rochester, Kensington, Wharf, Silvertip, and Las Chispas segments. The company explores for gold, silver, zinc, lead, and other related metals. It markets and sells its concentrates to third-party customers, including refiners and smelters, under off-take agreements. The company was formerly known as Coeur d'Alene Mines Corporation and changed its name to Coeur Mining, Inc. in May 2013. Coeur Mining, Inc. was incorporated in 1928 and is headquartered in Chicago, Illinois."
TTMI,NASDAQ,Growth,Electronic Components,Technology,mid,84.89,64.22472,38.87,0.89,3.6074471,3.73,57.599999999999994,0.0,8.18,20.41,206.49,179.51,"TTM Technologies, Inc. manufactures and sells mission systems, radio frequency (RF) components and RF microwave/microelectronic assemblies, and printed circuit boards (PCB) in the United States, Taiwan, and internationally. It operates in two segments, PCB and RF&S Components. The company offers a range of engineered systems, RF and microwave assemblies, HDI PCBs, flexible PCBs, rigid-flex PCBs, custom assemblies and system integration, IC substrates, passive RF components, advanced ceramic RF components, hi-reliability multi-chip modules, beamforming and switching networks, PCB products, RF components, and backplane/custom assembly solutions, including conventional PCBs. It also provides value-added services, such as design for manufacturability, PCB layout design, simulation and testing services, and quick turnaround production, as well as specialized assembly and RF testing. In addition, the company offers maritime surveillance and weather avoidance radar systems for fixed- and rotary-wing aircraft, unmanned aerial vehicles, and shipboard platforms; AN/APS-153 multi-mode radar; communications suite within the MH-60R/S multi-mission helicopters; and develops multi-mode maritime and overland surveillance AESA radar under MOSAIC brand. Further, it provides identification friend, monopulse secondary surveillance radars, and air traffic control systems; wired and wireless communication systems; custom electronic assemblies; quick turnaround services comprising prototype production and ramp-to-volume production; and thermal management. The company serves original equipment manufacturers and electronic manufacturing services providers, original design manufacturers, distributors, and government agencies; and aerospace and defense, data center computing, automotive, medical, industrial, and instrumentation, and networking markets. TTM Technologies, Inc. was incorporated in 1978 and is headquartered in Santa Ana, California."
SANM,NASDAQ,Growth,Electronic Components,Technology,mid,81.01,27.676659,38.87,4.67,3.0026717,3.73,33.0,0.0,8.28,26.72,72.52,91.65,"Sanmina Corporation provides integrated manufacturing solutions, components, products and repair, logistics, and after-market services in the Americas, the Asia Pacific, Europe, the Middle East, and Africa. It operates in two businesses, Integrated Manufacturing Solutions; and Components, Products and Services. The company offers product design and engineering, including concept development, detailed design, prototyping, validation, preproduction, manufacturing design release, and product industrialization; assembly and test services; direct order fulfillment and logistics services; after-market product service and support; and supply chain management services, as well as engages in the manufacture of components, subassemblies, and complete systems. In addition, the company provides components, such as printed circuit boards, backplane and backplane assemblies, cable assemblies, fabricated metal parts, precision machined parts, and plastic injected molded parts; memory solutions; storage platforms; optical, radio frequency, and microelectronic solutions; defense and aerospace products, design, manufacturing, repair, and refurbishment services; and cloud-based manufacturing execution software. It offers its products and services primarily to original equipment manufacturers in the industrial, medical, defense and aerospace, automotive, communications networks, and cloud infrastructure industries. The company was formerly known as Sanmina-SCI Corp. Sanmina Corporation was incorporated in 1980 and is headquartered in San Jose, California."
ATLCL,NASDAQ,Growth,NONE,NONE,small,78.01,,42.6,,,9.97,,6.178166493215402,0.34,3.13,6.16,11.27,None
COOP,NASDAQ,Growth,Mortgage Finance,Financial Services,large,71.67,23.631165,19.96,8.92,2.6452577,1.58,-2.9000000000000004,0.0095,12.45,40.64,59.33,123.27,"Mr. Cooper Group Inc., together with its subsidiaries, operates as a non-bank servicer of residential mortgage loans in the United States. It operates through two segments, Servicing and Originations. The Servicing segment performs activities on behalf of investors or owners of the underlying mortgages and mortgage servicing rights, including collecting and disbursing borrower payments, investor reporting, customer service, modifying loans, performing collections, foreclosures, and the sale of real estate owned. The Originations segment originates residential mortgage loans through its direct-to-consumer and correspondent channels. The company provides its services under the Mr. Cooper, Xome, and Rushmore Servicing brands. The company was formerly known as WMIH Corp. and changed its name to Mr. Cooper Group Inc. in October 2018. Mr. Cooper Group Inc. was founded in 1994 and is based in Coppell, Texas. As of October 1, 2025, Mr. Cooper Group Inc. operates as subsidiary of Rocket Companies, Inc."
SAND,NYSE,Growth,Gold,Basic Materials,mid,71.15,101.0,28.99,0.12,2.4876845,3.96,54.2,0.47,3.41,25.34,42.97,102.49,"Sandstorm Gold Ltd. operates as a gold royalty company. The company focuses on acquiring royalties and gold and other metals purchase agreements from companies that have advanced stage operating mines. It offers upfront payments for companies to acquire a stream and receives the right to purchase a percentage of a mine's production for the life of the mine. The company has a portfolio of 243 streams and royalties. It primarily has operations in Canada, Mexico, the United States, Mongolia, Burkina Faso, Ecuador, South Africa, Ghana, Botswana, Cote D'Ivoire, Argentina, Brazil, Chile, Peru, Egypt, Ethiopia, Guyana, Paraguay, French Guiana, Turkey, Sweden, Fiji, and Australia. The company was formerly known as Sandstorm Resources Ltd. and changed its name to Sandstorm Gold Ltd. in February 2011. Sandstorm Gold Ltd. was incorporated in 2007 and is headquartered in Vancouver, Canada."
PFXNZ,NASDAQ,Growth,NONE,NONE,nano,69.87,,42.6,,,9.97,,5.550619995247162,0.71,3.0,5.71,10.17,None
IREN,NASDAQ,Growth,Capital Markets,Financial Services,large,66.94,155.69232,20.0,0.39,8.622551,2.42,,0.0,67.18,234.55,986.23,539.83,"IREN Limited operates in the vertically integrated data center business in Australia and Canada. The company owns and operates computing hardware, as well as electrical infrastructure and data centers. It also mines Bitcoin, a scarce digital asset that is created and transmitted through the operation of a peer-to-peer network of computers running the Bitcoin software. The company was formerly known as Iris Energy Limited and changed its name to IREN Limited in November 2024. The company was incorporated in 2018 and is based in Sydney, Australia."
AMSC,NASDAQ,Growth,Specialty Industrial Machinery,Industrials,mid,65.87,150.05,28.93,0.4,8.137202,3.78,,0.0,-6.93,41.89,226.02,140.85,"American Superconductor Corporation, together with its subsidiaries, provides megawatt-scale power resiliency solutions worldwide. It operates through Grid and Wind segments. The Grid segment offers products and services that enable electric utilities, industrial facilities, and renewable energy project developers to connect, transmit, and distribute power under the Gridtec Solutions brand. The company provides transmission planning services, which identify power grid congestion, poor power quality, and other risks; grid interconnection solutions for wind farms and solar power plants, power quality systems, and transmission and distribution cable systems; D-VAR systems used for controlling power flow and voltage in the AC transmission system; actiVAR system, a fast-switching medium-voltage reactive compensation solution; armorVAR system installed for reactive compensation, power factor correction, loss reduction, utility bill savings, and mitigation of common power quality concerns related to power converter-based generation and load devices; and D-VAR volt var optimization (VVO) that serves the distribution power grid market. This segment also offers ship protection systems, which reduce a naval ship's magnetic signature; and Onboard power delivery systems, power generation systems, and propulsion systems; and transformers and rectifiers systems. The Wind segment designs wind turbine systems and licenses these designs to third parties under the Windtec Solutions brand. The company also supplies power electronics and software-based control systems, engineered designs, and support services; and provides customer support services to wind turbine manufacturers. This segment's design portfolio comprises a range of drivetrains and power ratings of 2 megawatts and higher. American Superconductor Corporation was incorporated in 1987 and is headquartered in Ayer, Massachusetts."
UI,NYSE,Growth,Communication Equipment,Technology,large,65.14,63.70894,27.76,11.75,67.7632,2.7,156.9,0.43,19.39,67.41,152.2,199.63,"Ubiquiti Inc. develops networking technology for service providers, enterprises, and consumers in North America, Europe, the Middle East, Africa, Asia Pacific, South America. The company develops technology platforms for high-capacity distributed Internet access, unified information technology, and consumer electronics for professional, home, and personal use. Its service provider product platforms offer carrier-class network infrastructure for fixed wireless broadband, wireless backhaul systems, and routing and related software; and enterprise product platforms provide wireless LAN infrastructure, video surveillance products, switching and routing solutions, security gateways, door access systems, and other WLAN products. It also provides technology platforms, such as UniFi Cloud Gateway, an Enterprise class internet and security gateway device; UniFi Wi-Fi, an enterprise Wi-Fi system; UniFi Protect, a video surveillance platform; UniFi Switch that deliver performance, switching, and power of ethernet support for enterprise networks; UniFi Access, a door access solution; UniFi Talk, a plug-and-play phone system and VoIP subscription service, as well as UniFi Connect and its AmpliFi platform. In addition, the company offers airMAX, which include proprietary protocols that contain technologies for minimizing signal noise; airFiber, a wireless backhauls point-to-point radio system; UFiber GPON, a plug and play fiber network technology to build high speed fiber internet networks; and Wave, a technology platform. Further, the company provides base stations, radios, backhaul equipment, and customer premise equipment; embedded radio products; and antennas. It serves customers through a network of distributors, online retailers, and direct to customers through webstores. The company was formerly known as Ubiquiti Networks, Inc. and changed its name to Ubiquiti Inc. in August 2019. Ubiquiti Inc. was incorporated in 2003 and is headquartered in New York, New York."
ETR,NYSE,Income,Utilities - Regulated Electric,Utilities,large,66.05,23.781635,20.86,4.03,2.638839,1.89,856.5,2.5,9.12,10.85,16.7,45.89,"Entergy Corporation, together with its subsidiaries, engages in the production and retail distribution of electricity in the United States. It generates, transmits, distributes, and sells electric power in portions of Arkansas, Louisiana, Mississippi, and Texas, including the City of New Orleans; and distributes natural gas. It also engages in the ownership of interests in non-nuclear power plants that sell electric power to wholesale customers, as well as provides decommissioning services to other nuclear power plant owners. It generates electricity through gas, nuclear, coal, hydro, and solar power sources. The company sells energy to retail power providers, utilities, electric power co-operatives, power trading organizations, and other power generation companies. The company's power plants have approximately 25,000 megawatts of electric generating capacity. It delivers electricity to 3 million utility customers in Arkansas, Louisiana, Mississippi, and Texas. Entergy Corporation was founded in 1913 and is headquartered in New Orleans, Louisiana."
JOF,NYSE,Income,Asset Management,Financial Services,nano,59.52,38.22222,11.8,0.27,1.0912552,1.0,,10.31,-4.13,8.15,27.52,41.46,"Japan Smaller Capitalization Fund, Inc. is a closed-ended equity mutual fund launched by Nomura Asset Management U.S.A. Inc. It is managed by Nomura Asset Management Co., Ltd. The fund invests in the public equity markets of Japan. It invests in stocks traded on the Tokyo, Osaka and Nagoya Stock Exchanges, JASDAQ, Mothers, Hercules, Centrex, and other indices. The fund seeks to invest in stocks of companies operating across diversified sectors. It primarily invests in stocks of small cap companies. The fund benchmarks the performance of its portfolio against the The Russell/Nomura Small Cap Index. It was formerly known as Japan OTC Equity Fund, Inc. Japan Smaller Capitalization Fund, Inc. was formed on March 22, 1990 and is domiciled in the United States."
AVAL,NYSE,Income,Banks - Regional,Financial Services,mid,57.69,11.636363,11.86,0.33,0.005133868,1.07,142.2,3.6,18.89,28.83,47.6,91.88,"Grupo Aval Acciones y Valores S.A. provides a range of financial services and products to public and private sector customers in Colombia and Central America. The company offers traditional deposit services and products, including checking accounts, savings accounts, time deposits, and other deposits. It also provides commercial loans comprising general purpose loans, working capital loans, leases, loans funded by development banks, corporate credit cards, and overdraft loans; consumer loans, such as payroll loans, personal loans, automobile and other vehicle loans, credit cards, overdrafts, leases, and general-purpose loans; and microcredit and mortgage loans. In addition, the company offers pension and severance fund management services; investment banking services, including services relating to capital markets, mergers and acquisitions, and delivering financial consulting services; mobile and online banking services; and bancassurance, insurance, trust, bonded warehousing, real estate escrow, merchandise and document storage and deposit, customs agency, cargo management, surety bond and merchandise distribution, and payment and collection services, as well as provides deposit and lending operations in foreign currencies. Further, it is involved in equity investments in various sectors, including infrastructure, energy and gas, agribusiness, and hospitality; and providing treasury operations. The company was incorporated in 1994 and is headquartered in Bogotá, Colombia."
KTH,NYSE,Income,INVESTMENT BANKING & INVESTMENT SERVICES,FINANCIALS,nano,49.11,,12.17,,,3.6,,6.61,1.29,3.55,5.32,5.28,None
EMF,NYSE,Income,Asset Management,Financial Services,nano,44.31,8.571428,11.8,1.96,1.127441,1.0,22.900000000000002,5.24,1.82,14.88,42.01,37.04,"Templeton Emerging Markets Fund is a closed-ended equity mutual fund launched by Franklin Resources Inc. The fund is managed by Templeton Asset Management Ltd. It invests in the public equity markets of emerging market countries across the globe. The fund seeks to invest in stocks of companies operating across diversified sectors. It primarily invests in value stocks of companies. The fund employs fundamental analysis with a focus on such factors as long-term earnings, asset value, and cash flow potential to create its portfolio. It benchmarks the performance of its portfolio against the MSCI Emerging Markets Index. Templeton Emerging Markets Fund was formed on February 26, 1987 and is domiciled in the United States."
XEL,NASDAQ,Income,Utilities - Regulated Electric,Utilities,large,43.87,22.481997,20.86,3.61,2.2890987,1.89,47.0,2.81,12.46,14.29,17.6,30.88,"Xcel Energy Inc., through its subsidiaries, engages in the generation, purchasing, transmission, distribution, and sale of electricity in the United States. It operates through Regulated Electric Utility and Regulated Natural Gas Utility segments. The company generates electricity through wind, nuclear, hydroelectric, biomass, and solar energy sources, as well as coal, natural gas, oil, wood, and refuse-derived fuels. It also purchases, transports, distributes, and sells natural gas to retail customers, as well as transports customer-owned natural gas. In addition, the company develops and leases natural gas pipelines, and storage and compression facilities; and invests in rental housing projects and nonregulated assets, as well as procures equipment for the construction of renewable generation facilities. It serves residential, commercial, and industrial customers in the portions of Colorado, Michigan, Minnesota, New Mexico, North Dakota, South Dakota, Texas, and Wisconsin. Xcel Energy Inc. was formerly known as Northern States Power company. The company was incorporated in 1909 and is headquartered in Minneapolis, Minnesota."
GCV,NYSE,Income,Asset Management,Financial Services,micro,43.84,14.066666,11.8,0.3,1.1692989,1.0,-46.6,11.37,3.18,10.8,33.42,28.18,"The Gabelli Convertible and Income Securities Fund Inc. is a closed-ended balanced mutual fund launched by GAMCO Investors, Inc. The fund is managed by Gabelli Funds, LLC. It invests in public equity and fixed income markets. The fund seeks to invest in stocks of companies operating across diversified sectors. It primarily invests in convertible securities and other debt and equity securities. The fund benchmarks the performance of its portfolio against the Standard & Poor's 500 Index, Barclays Government/Credit Bond Index, and Lipper Convertible Securities Fund Average. It was formerly known as Gabelli Convertible Securities Fund Inc. The Gabelli Convertible and Income Securities Fund Inc. was formed on December 19, 1988 and is domiciled in the United States."
CTDD,NYSE,Income,,,nano,42.38,,5.04,,,,,9.790000000000001,-4.24,6.04,29.72,26.26,"Qwest Corporation, a key player in the telecommunications sector, provides a diverse array of services to business and residential customers across 14 states, primarily in the Western and Midwestern United States. Based in Monroe, Louisiana, the company boasts a robust infrastructure tailored to meet the dynamic demands of its clientele. With a strategic emphasis on integrated communication solutions, Qwest is poised to benefit from the growing need for high-quality connectivity and data-centric services in an increasingly digital world, positioning itself as a strong contender for future growth and innovation."
